ID,Volume,Part,Page,Date,Author,Title,Quotation
supp_p1_a1,Supplement,,p1,1868.,"Bradshaw, Henry.","The Skeleton of Chaucer's Canterbury Tales:
an attempt ","to distinguish the several fragments of the work as left
by the author.
[A study continued in Prof. Skeat's Evolution of the Canterbury Tales, Chaucer
Society, 1903.]"
supp_p1_a2,Supplement,,p1,1868.,"Furnivall, Frederick James.","Essays on Chaucer, his words and
works, ed. F. J. Furnivall, 1868. Chaucer Soc.
[I. Prof. Ebert's review of Sandras's Étude sur Chaucer,
translated by J. W. van Rees Hoets.
II. A 13th-Century Latin treatise on the Chilindre (of the
Shipman's Tale), edited by E. Brock.]",
supp_p1_a3,Supplement,,p1,1868.,"Furnivall, Frederick James.","Ballads from Manuscripts, Ballad
Society, ","vol. i, pp. 67-9.
[p. 67] Chaucer, I have been assured, never hints at the immorality
[p. 68] of the Clergy, though he does speak strongly of that of the
Pardoner; those Tales in which he speaks of immoral monks,
friars, and priests, are borrowed from foreign literatures, and
cannot be taken to apply to the English clergy. This view
was new to me. It is ingenious; but if I can read Chaucer,
it isn't true. Take only two extracts, and judge ...
[Quotations of Epilogue to Nonne Preestes T. 1-13, of the
Parsones T., Reves T., on the morality of cleries follow.]"
supp_p1_a4,Supplement,,p1,1868.,N/A,"J. Early English Text Society. Report of the
Committee, January 1868, ","pp. 3, 6, 7, 10, 11.
[Notes on current Chaucer work.]"
supp_p1_a5,Supplement,,p1,1868-77.,"Furnivall, Frederick James.","A Six-Text Print of Chaucer's
Canterbury Tales ","in Parallel Columns from the following MSS:—
1. The Ellesmere; 2. The Hengwrt 154; 3. The Cambridge
Univ. Libr. Gg. 4. 27; 4. The Corpus Christi Coll., Oxford;
5. The Petworth; 6. The Lansdowne 851. Chaucer Society,
London, 1868-77.
[The six-text edition contains when complete :—
The Dedication: To Prof. Francis James Child, etc.
(1) Specimens of the two chief moveable Prologues in the
Canterbury Tales when they are moved from their right
places, and of some of the substitutes for them:
I. Specimens of the Man of Law's End-Link, the real
Shipman's Prologue, when moved from its right
place.
II. Specimens of the Spurious Prologue to the Shipman's
Tale.
III. Specimens of the Squire's End-Link (which should
head the Franklin's Tale), when the Franklin's
Tale is moved from its right place, and the
Squire's End-Link is used as the Merchants'
Prologue.
IV. Specimens of the False Prologues to the Franklin's
Tale when it is moved from its right place after
the Squire's Tale [pp. 4-78].
(2) Trial-Tables (now superseded) of the Groups of Tales,
and their order in Chaucer’s ""Canterbury Tales,"" according to
the Edited Manuscripts and Tyrwhitt. (pp. xxi*-xxiii*).
(3) Drawings of the 23 Tellers of the 24 Canterbury Tales,
copied from the Ellesmere MS., and cut on Wood, by Mr. W.
H. Hooper, and coloured after the Originals, under his direction,
for the Chaucer Society. (9 leaves.)
(4) The Texts of the Tales from the six MSS., as quoted
above, pp. 1-685, and including, (5) Appendix to Group A.
The Spurious Tale of Gamelyn (with its spurious Head-Links)
from the following 6 MSS.:—Royal MS. 18. C. ii.; Harleian
1758; Sloane, 1685; Corpus MS. (Oxford); Petworth MS.;
Lansdowne MS. 851 [pp. xxv-lxxvii].
(6) Ryme-Index to the Ellesmere Manuscript of Chaucer's
Canterbury Tales. By Henry Cromie, M.A., 1875. [pp.
1*-255*,—or in triple-texed pages with parallel columns,
I†-lxxxv†: and including the Notes and Corrections for the
Ryme-Index, i†-lxxxviii†.]
[See Skeat's Euolution of the Canterbury Tales for a study
of the sequence of the Tales as set forth in the Six-Text
edition. Each of the texts constituting the Six-Text edition
was printed separately, for editorial use, 1868-77: see the
next 'allusion']. Child himself had conceived the idea of
printing a six or eight-text Chaucer. See the notice of a note
on the subject in the Reader, under 1865, Furnivall (?)"
supp_p26_a1,Supplement,,p26,1870.,Unknown.,Report ,"[in] First Report of the Royal Commission
on Historical Manuscripts, Appendix, London, 1870, p. 95.
Historical Documents Preserved in the Muniment Room
of Westminster Abbey. . . .
A lease from the Custos Capellæ Beatæ Mariæ to Geoffrey
Chaucer of a house on or near a place where King Henry
VII's Chapel now stands; dated 24th December, 1399."
supp_p26_a2,Supplement,,p26,1871.,"Brooke, Stopford ","A. The Descriptive Poetry of Chaucer, ","[in]
Macmillan's Magazine, London, August 1871, vol. xxiv, pp. 268-74.
[p. 269] The landscape of Chaucer is sometimes taken from the
Italian and sometimes from the French landscape. It possesses
almost always the same elements, differently mixed up in
different poems: a May morning—the greenwood, or a
garden—some clear running water—meadows covered with
flowers—some delectable place or other with an arbor laid
down with soft and fresh-cut turf. There is no sky, except in
such rapid allusions as this, ""Bright was the day and blue the
firmament ;"" no cloud studies; no conception of the beauty of
wild nature.
His range, therefore, is extremely limited; but within the
limits his landscape is exquisitely fresh, natural, and true in
spite of its being conventional.
. . . But of all the colours which Chaucer loved in nature,
he loved best the harmony of white and green in one of his
favourite daisied meadows.
. . . It may be in an age when colours in art had each their
peculiar religious significance, that Chaucer, a man who had
travelled in Italy and who had himself the instinct of sym¬
bolism, had some spiritual meaning in the constant association
of these two colours of white and green. Green, the hue of
spring, signified hope, and particularly the hope of Immor¬
tality; white was the emblem, among other things, of light
and joy.
[p. 278] . . . Still dwelling on Chaucer's colour, it is curious the
number of concentrated pictures which are to be found in his
poems, pictures so sharply drawn in colour that they might
be at once painted from the description. ... One sees that,
""flashing upon the inward eye,"" not in outline, nor in detail,
but in colour, and that is the test whether a poet is a good
colourist or not. It is no common excellence.
... There is a splendid study of colour, unequalled in its
way in our literature, in Chaucer's picture of the cock in the
""Nun’s Priests Tale."" The widow keeps in her yard a famous
stock of poultry
""In which she had a cock, hight Chaunticlere [to]
And lik the burnischt gold was his colour.""
[p. 74] . . . This simple childlikeness and intensity of Chaucer ...
are the first necessity of a poetic nature, ... This is the first
of those elements of his poetry which make his landscapes
impossible to be painted.
Of two other unpaintable things the landscape is also full—
of the scent of flowers, and the songs of birds, and now and
then of the noise of water. ...
"
supp_p27_a1,Supplement,,p27,1871-89.,"Courthope, William ","J., and Elwin, Whitwell. Works of
Alexander Pope, with Intr. and Notes by Rev. W. Elwin and
W. J. Courthope.
[Vol. i.] Chaucer, ","p. 21. Pope's Translation from the Tales, 113.
General Criticism on, 115-122. January and May, 123.
Wyf of Bathes Prol. 155. Versatility of his genius and his
characteristics, 193. Influence of Italian poets, 190. Hous
of Fame, 187-229.
[Vol. ii] Knightes, T., pp. 63, 152. Frankeleyns T., 241, 454.
[Vol. iii.] pp. 36, 351.
[Vol. v.] Prologue, p. 17. Chaucer's good sense, 67. Spirit of classical
[Vol. vi.] pp. 76, 124.
poetry revived in, 356.
[Vol. ix.] Flower and Leaf, p. 431.
[Vol. x.] Shakespeare's obligations to Chaucer, pp. 541-2. See also
under Index.]"
supp_p28_a1,Supplement,,p28,1871.,"Earle, John.","The Philology of the English Tongue. Fourth
edition, revised throughout and re-","written in parts, 1887.
Paragraphs 67, 73, 93, 125, 144, 155, 169, 177, 179, 200,
201, 232, 254, 264, 269, 280, 283, 292, 323, 326, 328, 336,
338, 395, 409, 423, 483, 489, 492, 535, 577, 647.
[p. 74,
par. 74]
But it is in the writings of Chaucer and Gower that we have
for the first time a full display of King’s English. These two
names have been coupled together all through the whole course
of English literature. Skelton . . . joins the two names
together. So does our literary king, James I. So have all
writers who have had occasion to speak of the fourteenth
century, down to the present day. ... Thus these two names
have grown together, and their connection is soldered by
habit and tradition. One is apt to imagine, previous to a
study of their works, that they were a par nobile fratrum,
brothers and equals in poetry and genius, and that they had
[p. 75] English literature. But this is very far from being the case.
contributed equally, or nearly so, towards the making of
That which united them at first, and which continues to be
the sole ground of coupling their names together, is just this,—
that they wrote in the same general strain and in the same
language. By this is meant, first, that they were both versed
in the learning then most prized, and delivered what they had
had to say in the terms then most admired; and secondly,
that both wrote the English of the court. If affinity of
genius had been the basis of classification, the author of Piers
Plowman had more right to rank with Chaucer than the
prosaic Gower. But Chaucer and Gower are united inasmuch
as they both wrote the particular form of English which
became more and more established as the standard form of the
national language, and their books were classics of the best
society down to the opening of a new era under Elizabeth."
supp_p28_a2,Supplement,,p28,1871.,N/A,"J. Balade by Chaucer, [a leaf, re","printed from] The
Athenæum, No. 2260, London, 1871, p. 210.
[A balade from Addit. MS. 16, 158, 2 stanzas of 7,
beginning:]
Sith hit is so / þer as hit may not freese
þat cuery night / but I haþe sume solas
I wol me venge on loue as doþe a breese [etc.]
This turned out to be only the second stanza of the balade.
The whole was printed by Dr. Furnivall with Jyl of Breynt¬
ford, 1871: see below."
supp_p29_a1,Supplement,,p29,1871,N/A,J. Triat-Forewords ,"to my ""Parallel-Text Edition
of Chaucer's Minor Poems,"" for the Chaucer Society (with a try
to set Chaucer's works in their right order of time). Chaucer
Society, 1871.
[The contents are :]
PAGE
Reasons for these ""Forewords"" . . . . 5
Interest in watching Chaucer's progress . . . 5
Prof. Ten Brink's and Mr. Bradshaw's work . . 6
The Romaunt of the Rose . . . . 7
The Blaunche, and Chaucer's latest poems . . 7
1386 A.D. the centre of Chaucer's life . . . 9
Chaucer's own list of his early works . . . 10
His Compleynte to Pite his earliest original work . 12
His A.B.C., p. 12; and (2) Lydgate’s account of it . 13
Chronological List of Chaucer's Works . . . 18
"" "" dates in Chaucer's Life . . 17
DETAILED EXAMINATION OF EACH OF CHAUCER'S
MINOR POEMS.
I. POEMS OF THE FIRST PERIOD, TO 1373 A.D.
(The A. B. C. perhaps Chaucer's first poem.)
1. The Complaynte to Pite, 1366-8 A.D. . . 29
2. The Dethe of Blaunche the Duchesse, 1369 A. D. . 33
II. POEMS OF THE SECOND PERIOD, FROM 1373 TO 1385 A.D.
3. The Parliament of Foules, ? 1374 A.D. . . 53
(The Saturday Review bubble burst, pp. 69-74.)
4. The Compleynt of Mars. . . . . 78
(The Hero and Heroine of it, pp. 80-4.)
[to be continued]
Conclusion to Part I. . . . . . . 91
HINDWORDS . . . . . . . . 93
NOTES . . . . . . . . . 103
APPENDIX. I. Translation of the Lease to Chaucer in 1375 A.D.
of a house in Aldgate from the Corporation of London (from
Riley), p. i. 2. The name of ""Chaucer"" in connection with the City
of London (from Riley), p. ii. 3. The Duke of Lancaster's grant ot
£10 a year to Chaucer, p. iv."
supp_p30_a1,Supplement,,p30,1871.,N/A,"J. Jyl of Breyntford's Testament ... [and] A
Balade or two by Chaucer, ed. F. J. Furnivall, London. ","Printed
for Private Circulation, 1871, pp. 5, 6, 25n., 34-6, 38.
[The first balade, apparently ascribed to Chaucer by Shirley,
is the one of which Dr. Furnivall had previously in 1871
printed two stanzas: see above. It comes from Shirley's MS.,
Addit. 16, 165, and begins:
'Hit is no right alle oþar lustes to leese,' etc.
The second, from the same MS., begins:
'Of alle þe crafftes oute / blessed be þe ploughe,' etc.
The third piece is the 'Proverbe of Chaucer,' beginning
What shal þees cloþes þus many fold] (Skeat, Minor Poems,
XX, p. 407)."
supp_p30_a2,Supplement,,p30,1871.,"Horwood, Alfred ","J. Report, ","[in] Second Report of the Royal
Commission on Historical Manuscripts, Appendix, London, 1872,
p. 106.
The Hengwrt and Peniarth Manuscripts of Wm. W. E.
Wynne, Esq., at Peniarth, Co. Merioneth.
A fine copy in vellum, 15th century, of Chaucer’s Canter¬
bury Tales, No. 154. (This has been used by the Chaucer
Society.) Part of the 1st book, the 2nd book and part of the
3rd book of his translation of Bœthuis, 15th century (328) . ."
supp_p30_a3,Supplement,,p30,1871.,"Lowell, James Russell.","Pope. Riverside edn. of Works, London
1890, ","vol. iv, p. 25.
Thus far, among the great English poets who preceded him
[Pope], we have seen actual life represented by Chaucer,
imaginative by Spenser, ideal life by Shakespeare, the interior
life by Milton."
supp_p30_a4,Supplement,,p30,1871.,N/A,A. Prints of John of Gaunt's Grant ,"to Chaucer of £10
a year for life, 13 June, 1374, and his Warrant of 20 Jan., 1375,
to John de Yerdeburgh, Clerk of his Great Wardrobe, to pay
Chaucer's Pension (and others), [in] The Athenæum, No.
July 8, p. 49.
"
supp_p31_a1,Supplement,,p31,1871],N/A,Letters ,"to F. S. Ellis, November 2nd. Works
of Ruskin, Library edn., ed. E. T. Cook and A. Wedderburn, 1909,
vol. xxxvii, p. 639.
I have resolved to take Chaucer’s Dream instead of The
Flower and the Leaf, and I think I can make a very pretty and
useful introduction to everything out of it.
[Note by the editors: The letter refers to a series of Early
English Reprints, to be furnished with Introductions by
himself, which Ruskin at this time had thoughts of publishing
through Mr. Ellis, who, however, had reminded him that
The Flower and the Leaf is not now esteemed to be by Chaucer.
The same difficulty applies to ""Chaucer’s Dream""; which,
however, ""authentic or not,"" Ruskin subsequently intended
to include in his Bibliotheca Pastorum.]
[Another to the same, 1871 (?) : ]
Will you please find and send mo the best authoritative
edition of Chaucer? I don’t mean an early expensive edition,
even if you could find one; but the best modern one, what
anybody wishing now to read Chaucer would be obliged to
put with up.
[Note by the editors: ""These was no 'authoritative'
edition of Chaucer in 1874—and there is not one to-day,""
said Mr. Ellis in a note to this letter. At a later date (1896),
he himself edited Chaucer for the Kelmscott Press edition.]"
supp_p32_a1,Supplement,,p32,1871.,"Ruskin, John.","Lectures on Landscape, Lecture III, Colour,
(delivered 1871, published 1897). Works of Ruskin, Library edn.,
ed. E. T. Cook and A. Wedderburn, 1906, ","vol. xxii, pp. 64-5.
Exquisite order, and universal, with eternal, life and light,
this is the faith and effort of the schools of Crystal; and you
may describe and complete their work quite literally by
taking any verses of Chaucer in his tender mood, and observ¬
ing how he insists on the clearness and brightness first, and
then on the order. Thus in Chaucer’s ""Dream"":
""Within an yle me thought I was,
Where wall and yate was all of glasse, ...
[to]
That never been none seene in May.""1
1 Footnote by editors: Lines 72-85 of the poem called Chauceres Dreme, no longer,
generally attributed to Chaucer."
supp_p32_a2,Supplement,,p32,1871.,"Ruskin, John.","Fors Clavigera, ","vol. I., Letter 5 (May 1871).
Works of Ruskin, ed. E. T. Cook and A. Wedderburn, 1907,
vol. xxvii, p. 84.
There are no such things as Flowers—there are only—
gladdened Leaves. Nay, farther than this, there may be a
dignity in the less happy, but unwithering leaf, which is,
in some sort, better than the brief lily of its bloom;—which
the Greek poets always knew,—well;—Chaucer, before
Goethe; and the writer of the first Psalm before Chaucer."
supp_p32_a3,Supplement,,p32,1871.,"Skeat, Walter ","W. Essay on the Rowley Poems, ","[in] The Poetical
Works of Thomas Chatterton. 2 vols. London, 1871. Vol. ii,
pp. xiii, xv, xvii, xx, xxiv, xxv, xxvi, xxvii, xxx."
supp_p32_a4,Supplement,,p32,1871.,"Stevenson, Jos.",Report ,"[in] Second Report of the Royal Com¬
mission on Historical Manuscripts, Appendix, London, 1871, p. 145.
The manuscripts in the Library of Stonyhurst College,
belonging to the Society of Jesus. ...
26. A volume in 4to, upon vellum, with ornamented
capitals, written in the 15th century, consisting of 67 leaves.
It contains,—. . .
ii. The tale of Mellybe and Prudence, from Chaucer's
Canterbury Tales. Fol. 34."
supp_p33_a1,Supplement,,p33,1871.,Unknown.,"Geoffrey Chaucer and William Morris, ","[in] New
Monthly Magazine, Sept. 1871, vol. cxlix, pp. 280-6.
[A comparison between the work of Morris and Chaucer,
[p. 282] showing that the similarity is in superficial points: the dif¬
ference is deep and spiritual. ""We have the thought of
""quick-coming death"" as an under-tone to all Morris’s work,
which contrasts markedly with the spirit of Chaucer.""
[Morris has chosen the realm of romance, Chaucer the life of
every day.]"
supp_p33_a2,Supplement,,p33,1872.,"Horwood, Alfred ","J., and Martin, J. E. Report ","[in] Third
Report of the Royal Commission on Historical Manuscripts,
Appendix, London, 1872, p. 112.
The manuscripts of His Grace the Duke of Northumber¬
land at Alnwick Castle ...
Chaucer’s Canterbury Tales. Vellum. Folio. 15th
century. Incip. imperf. at l. 157 of the Prologue ...
[other lacunæ].
This MS. belonged to Mrs. Thynne, grandmother of the
first Duchess of Northumberland, and from it they printed
the history of Beryn, which is not to be found in other MSS.
[See 1712, Urry. The above section of the Appendix
seems to be based on the manuscript catalogue of the North¬
umberland MSS. made by J. E. Martin, then librarian of the
Inner Temple: See Report, p. xii.]"
supp_p33_a3,Supplement,,p33,1872.,"Horwood, Alfred ",J. Report ,"[in] Third Report of the Royal
Commission on Historical Manuscripts, Appendix, London, 1872,
pp. 181, 188-9, 198.
The manuscripts of the Most Honourable the Marquis of
Bath, at Longleat, Co. Wilts. . . .
[p. 181] A 4to volume, vellum, 15th century ... [containing
with other non-Chaucerian pieces, The Parsones Tales].
This, in the Table, is called the three parties of Penance. . .
[p. 188] Folio, paper, 16th century.—The Temple of Glasse, by
Chaucer.
Folio, vellum, c. 1400.
The Sege of Thebes; by John Lydgate.
The Knight’s Tale; by Chaucer.
Grisild; by Chaucer.
Ipomedar.
Small folio, paper, 15th century. The outside leaves of
each quire are vellum. This volume contains minor poems
[p. 189] of Lydgate and Chaucer. Sixteen leaves are wanting,
containing, as appears by the table of contents, the Flower
and the leaf,1 and part of the Complaint of Mars, of which
only the last 32 stanzas are here.
The Declaration of deth of pite. . .
The assemble of ladyes.
The complaint of Annelada against Arcile [sic], the fals
Theban Knight (43 stanzas) ...
The assemble of foules.
The ye and the hert ...
The chorle and the birde—
Envoy ot 8, beginning, ""Go little quayer.""
Folio, paper, 15th century.—The Temple of Glasse.
[p. 198] 1709, May 28. Oxford. Thomas Hearne to Lord Oxford:
concerning Chaucer. [See above, 1709, Hearne. The letter
was to John Bagford, not Lord Oxford. Oxford sub-
sequently acquired Bagford’s collections.]
1 [Footnote] Mr. Furnivall says that no manuscript of this poem is known to exist."
supp_p34_a1,Supplement,,p34,1872.,"Isberg, Carl.","Grammatical Studies of Chaucer's Language.
Upsala, 1872, 8vo.",
supp_p34_a2,Supplement,,p34,1872.,"Lowell, James Russell.","Dante, Riverside edn. of Works,
","vol. iv, pp. 146, 155.
[p. 146] In England the first recognition of Dante is by Chaucer in
the ""Hugelin of Pisa"" of the ""Monkes Tale,""1 and an
invitation of the opening verses of the third canto of the
Inferno (""Assembly of Foules"").
1 It is worth notice, as a proof of Chaucer's critical judgment, that he calls
Dante ""the great poet of Itaille,"" while in the ""Clerke’s Tale"" he speaks of
Petrarch as a ""wurthy clerk,"" as ""the laureat poete"" (alluding to the somewhat
sentimental ceremony at Rome), and says that his
""Rhetorike sweete
Enlumined all Itaille of poetry."""
supp_p34_a3,Supplement,,p34,1872.,"Morris, Richard.","Old English Miscellany. Ed. R. Morris,
E.E.T.S., ","pp. vii, ix.
p. vii] [Chaucer's quotation in the Nonne Preestes T. from the
Bestiary, probably from the Latin version.]
[p. ix] The vocabulary [of the Old Kentish Sermons] is sometimes
remarkably modern, and such phrases as This is si GLORIUS
MIRACLE; this is si SIGNEFIANCE of the MIRACLE, have a very
quaint appearance on account of their composite character;
but at the same time they clearly indicate the influence that
Norman French exercised upon the vocabulary of the Southern
dialect toward the end of the thirteenth century. They also
show that Chaucer was not the sinner he has been represented
to be, and that he did not inundate the language with French
words that had not been in common use previous to his time."
supp_p36_a1,Supplement,,p36,1872.,"Romilly, John, ","[etc.]. Third Report of the Royal Commission
on Historical Manuscripts, London, 1872, ","pp. xiii, xiv.
p. xiii] The collection of Manuscripts belonging to the Marquis of
Bath is large and extremely valuable. ... Among the early
English works are some by Wiclif in the l4th century, John
Alcock, and John Morton in the 15th century; poems by
Chaucer and Lydgate, and prose and poetry by Richard
Hampole and Walter Hylton. A volume in this collection
written about the middle of the 15th century contains poems
by Chaucer and Lydgate, and the table of contents shows
that ""The Flower and the Leaf"" was among them; but
unfortunately it has now disappeared. ...
[p. xiv] ... A letter by Thomas Hearne about Chaucer and the
editions of his works. [See 1707, Hearne.]
The Report is signed by the thirteen commissioners, Earl
Salisbury, etc.—besides the secretary, John Romilly.]
"
supp_p37_a1,Supplement,,p37,1872.,"Ruskin, John.","The Eagle's Nest, Lecture III. Wise Art and
Wise Science. Works of Ruskin, Library edn., ed. E. T. Cook and
A. Wedderburn, ","vol. xxii, pp. 160-2.
I gave you, in a former lecture, the Skylark as a type of
mastership in music; and remembering—some of you, I
suppose, are not likely soon to forget,—the saint to whom
yesterday was dedicated. [St. Valentine] let me read you
to-day some of the prettiest English words in which our
natural feeling about such song is expressed.1
1 Footnote by editors: The Cuckow and the Nightingale. For other notes on the
birds of Chaucer, see Munera Pulveris, § 149n., vol. xvii, p. 278 n.]
""And anone, as I the day espide [to]
And held the way downe by a brook side.""
[And four following stanzas. ]
You recollect, perhaps, the dispute that follows between
the cuckoo and the nightingale, and the promise which the
sweet singer makes to Chaucer for rescuing her.
""And then came the Nightingale to me [to]
The next May, if I be not affraied.""
""If I be not affraied."" Would she not put the ""if"" more
timidly now, in making the same promise to any of you,
or in asking for the judgment between her and her enemy,
which was to be passed, do you remember, on this very day
of the year, so many years ago, and within eight miles of
this very spot?
""And this shall be without any Nay"" [to]
""And there she sate, and sang upon that tree
'Terme of life Love hath withheld me'
So loud, that I with that song awoke.""
57. ""Terme of life love hath withheld me !"" Alas, how
have we men reversed this song of the nightingale! so that
our words must be ""Terme of life—hatred hath withheld
me."""
