ID,Volume,Part,Page,Date,Author,Title,Quotation
supp_p71_a1,Supplement,,p71,1879.,"Ward, Sir Adolphus William.","Chaucer (English Men of Letters
Series, ed. John Morley).
[Contents: Chap. I, Chaucer's Times; Chap. Il, Chaucer's
Life and Works; Chap. III, Characteristics of Chaucer and
of his Poetry; Chap. IV, Epilogue; Glossary.]
[","p. 146] One very pleasing quality in Chaucer must have been his
modesty. In the course of his life this may have helped to
recommend him to patrons so many and so various, and to
make him the useful and trustworthy agent that he evidently
became for confidential missions abroad. ... To us, of course,
this quality of modesty in Chaucer makes itself principally
manifest in the opinion which he incidentally shows himself
to entertain concerning his own rank and claims as an author.
Herein, as in many other points, a contrast is noticeable
between him and the great Italian masters. ... Chaucer
again and again disclaims all boasts of perfection, or pre-
[p. 147] tensions to pre-eminence, as a poet. ... He acknowledges
as incontestable the superiority of the poets of classical
antiquity.
[p. 177] The vivacity and joyousness of Chaucer’s poetic tempera¬
ment ... show themselves in various other ways besides his
favourite manner of treating a favourite theme. They
enhance the spirit of his passages of dialogue, and add force
and freshness to his passages of description. They make
him amusingly impatient of epical lengths, abrupt in his
transitions, and anxious, with an anxiety more usually mani-
fested by readers than by writers, to come to the point, ""to
the great effect,"" as he is wont to callit. ... And he uncon¬
sciously suggests a striking difference between himself and the
great Elizabethan epic poet who owes so much to him, when
he declines to make as long a tale of the chaff or of the straw
as of the corn, and to describe all the details of a marriage-
feast seriatim:
The fruit of every tale is for to say:
They eat and drink, and dance and sing and play. . . .
Most assuredly he can tell a story with admirable point and
[p. 178] precision, when he wishes to do so. Perhaps no better
example of his skill in this respect could be cited than the
Manciple’s Tale, with its rapid narrative, its major and
minor catastrophe, and its concise moral, ending thus:—
My son, beware, and be no author new
[and 3 following lines].
at the same time, his frequently recurring announcements
of his desire to be brief have the effect of making his narrative
appear to halt, and thus unfortunately defeat their own
purpose. An example of this may be found in the Knight's
Tale, a narrative poem of which, in contrast with its beauties,
a want of evenness is one of the chief defects. It is not
that the desire to suppress redundancies is a tendency de¬
serving anything but commendation in any writer, whether
great or small; but rather, that the art of concealing art
had not yet dawned upon Chaucer.
Closely allied to Chaucer’s liveliness and gaiety of dis¬
position, and in part springing from them, are his keen sense
of the ridiculous and the power of satire which he has at his
command. His humour has many varieties, ranging from
the refined and half-melancholy irony of the House of Fame
[p. 180] to the ready wit of the sagacious uncle of Cressid, the burl¬
esque fun of the inimitable Nun’s Priest's Tale, and the very
gross salt of the Reeve, the Miller, and one or two others. . . .
Concerning, however, Chaucer’s use of the power which he in
so large a measure possessed, viz. that of covering with ridi¬
cule the palpable vices or weaknesses of the classes or kinds
of men represented by some of his character-types, one
assertion may be made with tolerable safety. Whatever
may have been the first stimulus and the ultimate scope of
the wit and humour which he here expended, they are not
to be explained as moral indignation in disguise. And in
truth Chaucer’s merriment flows spontaneously from a
source very near the surface; he is so extremely diverting,
because he is so extremely diverted himself.
Herein, too, lies the harmlessness of Chaucer's fun. Its
harmlessness, to wit, for those who are able to read him in
something like the spirit in which he wrote.
But the realism of Chaucer is something more than exuber¬
ant love of fun and light-hearted gaiety. He is the first
great painter of character, because he is the first great
observer of it among European writers. ... More especially
with regard to the manners and ways of women, which
often, while seeming so natural to women themselves, appear
so odd to male observers, Chaucer's eye was ever on the
alert.
. . . . . . .
[p. 187] His descriptions of nature are as true as his sketches of
human character; and incidental touches in him reveal his
love of the one as unmistakably as his unflagging interest
in the study of the other. Even those May-morning exordia,
in which he was but following a fashion—faithfully observed
both by the French trouvères and by the English romances
translated from their productions and not forgotten by the
author of the earlier part of the Roman de la Rose—always
came from his hands with the freshness of natural truth. ...
For nowhere does he seem, and nowhere could he
have been, more open to the influence which he received
into himself, and which in his turn he exercised, and
exercises, upon others, than when he was in fresh contact
with nature. In this influence lies the secret of his genius;
in his poetry there is life.
[Chap. IV, 'Epilogue gives a sketch of the influence of
Chaucer.']"
supp_p74_a1,Supplement,,p74,1879.,"Wood, Henry.","Chaucer's Influence upon King James I of
Scotland as poet. Halle, 1879 (Leipsiger dissertation).",
supp_p74_a2,Supplement,,p74,1880.,"Arnold, Matthew, ",,"[in] Essays in Criticism, second series, 1891,
pp. 26-34, Essay on ""The Study of Poetry"" published in 1880 as
the General Introduction to The English Poets, edited by
T. H. Ward.
[p. 26] But in the fourteenth century there comes an Englishman
nourished on this poetry [French romance-poetry], taught his
trade by this poetry, getting words, rhyme, metre from this
poetry; for even of that stanza which the Italians used, and
which Chaucer derived immediately from the Italians, the basis
and suggestion was probably given in France. Chaucer (I
have already named him) fascinated his contemporaries, but so
too did Christian of Troyes and Wolfram of Eschenbach.
[p. 27] Chaucer's power of fascination, however, is enduring; his
poetical importance does not need the assistance of the
historic estimate; it is real. He is a genuine source of joy
and strength, which is flowing still for us and will flow
always. He will be read, as time goes on, far more generally
than he is read now. His language is a cause of difficulty to
us, but so also, and I think in quite as great a degree, is the
language of Burns. In Chaucer's case, as in that of Burns, it
is a difficulty to be unhesitatingly accepted and overcome.
If we ask ourselves wherein consists the immense
superiority of Chaucer's poetry over the romance poetry—why
it is that in passing from this to Chaucer we suddenly feel
ourselves to be in another world, we shall find that his
superiority is both in the substance of his poetry and in the
style of his poetry. His superiority in substance is given by
his large, free, simple, clear yet kindly view of human life,—
so unlike the total want, in the romance-poets, of all intelli¬
[p. 28] gent command of it. Chaucer has not their helplessness; he
has gained the power to survey the world from a central, a
truly human point of view. We have only to call to mind
the Prologue of The Canterbury Tales. The right comment
upon it is Dryden’s 'It is sufficient to say, according to the
proverb, that here is God’s plenty.' And again: 'Here is a
perpetual fountain of good sense.' It is by a large, free,
sound representation of things, that poetry, this high criticism
of life, has truth of substance.
Of his style and manner, if we think first of the romance-
poetry and then of Chaucer’s divine liquidness of diction, his
divine fluidity of movement, it is difficult to speak temperately.
They are irresistible, and justify all the rapture with which
his successors speak of his ""gold dewdrops of speech.""
Johnson misses the point entirely when he finds fault with
Dryden for ascribing to Chaucer the first refinement of our
numbers, and says that Gower can also show smooth numbers
and easy rhymes. The refinement of our numbers means
[p. 29] something far more than this. A nation may have versifiers
with smooth numbers and easy rhymes, and yet may have no
real poetry at all. Chaucer is the father of our splendid
English poetry; he is our 'well of English undefiled,' because
by the lovely charm of his movement, he makes an epoch
and founds a tradition. In Spenser, Shakespeare, Milton,
Keats, we can follow the tradition of the liquid diction, the
fluid movement of Chaucer; at one time it is his liquid diction
of which in these poets we feel the virtue, and at another
time it is his fluid movement. And the virtue is irresistible.
... I must yet find room for an example of Chaucer's
virtue. ... I feel disposed to say that a single line is enough
to show the charm of Chaucer's verse; that merely one line
like this—
'O martyr soudered1 in virginitee!'
1 The French soudé, soldered, fixed fast.
[p. 30] has a virtue of manner and movement such as we shall not
find in all the verse of romance-poetry;—but this is saying
nothing. The virtue is such as we shall not find, perhaps, in
all English poetry, outside the poets whom I have named as
the special inheritors of Chaucer's tradition. A single line,
however, is too little if we have not the strain of Chaucer's
verse well in our memory; let us take a stanza. It is from
The Prioress’s Tale, the story of the Christian child murdered
in a Jewry—
'My throte is cut unto my nekké-bone
Saidè this child, and as by way of kinde
I should have deyd, yea, longè time agone [etc.].
Wordsworth has modernised this Tale, and to feel how delicate
and evanescent is the charm of verse, we have only to read
Wordsworth’s first three lines of this stanza after Chaucer's—
'My throat is cut unto the bone, I trow,
Said this young child, and by the law of kind
I should have died, yea, many hours ago.'
[p. 31] The charm is departed. It is often said that the power of
liquidness and fluidity in Chaucer's verse was dependent
upon a free, a licentious dealing with language such as is now
impossible; upon a liberty, such as Burns too enjoyed, of
making words like neck, bird, into a dissyllable by adding to
them, and words like cause, rhyme, into a dissyllable by sound
sounding the e mute. It is true that Chaucer’s fluidity is
conjoined with this liberty, and is admirably served by it;
but we ought not to say that it was dependent upon it. It
was dependent upon his talent. Other poets with a like
liberty do not attain to the fluidity of Chaucer; Burns him¬
self does not attain to it. Poets, again, who have a talent
akin to Chaucer's, such as Shakespeare or Keats, have known
how to attain to his fluidity without the like liberty.
And yet Chaucer is not one of the great classics. His
poetry transcends and effaces, easily and without effort, all
the romance-poetry of Catholic Christendom; it transcends
[p. 32] and effaces all the English poetry contemporary with it, it
transcends and effaces all the English poetry subsequent to it
down to the age of Elizabeth. Of such avail is poetic truth
of substance, in its natural and necessary union with poetic
truth of style. And yet, I say, Chaucer is not one of the
great classics. He has not their accent. What is wanting to
him is suggested by the mere mention of the name of the first
great classic of Christendom, the immortal poet who died
eighty years before Chaucer,—Dante. The accent of such
verse as
""In la sua volontade e nostra pace...""
is altogether beyond Chaucer's reach; we praise him, but we
feel that this accent is out of the question for him. It may be
said that it was necessarily out of the reach of any poet in
the England of that stage of growth. Possibly; but we are to
adopt a real, not a historic, estimate of poetry. However, we
may account for its absence, something is wanting, then, to
the poetry of Chaucer, which poetry must have before it can
be placed in the glorious class of the best. And there is a
[p. 33] doubt what that something is. It is the σπονδαιότης, the
high and excellent seriousness which Aristotle assigns as one
of the grand virtues of poetry. The substance of Chaucer's
poetry, his view of things and his criticism of life, has
largeness, freedom, shrewdness, benignity; but it has not
this high seriousness. Homer's criticism of life has it,
Dante's has it, Shakespeare's has it. It is this chiefty
which gives to our spirits what they can rest upon; and with
the increasing demands of our modern ages upon poetry, this
virtue of giving us what we can rest upon will be more and
more highly esteemed. A voice from the slums of Paris, fifty
or sixty years after Chaucer, the voice of poor Villon out of
his life of riot and crime, has at its happy moments (as, for
instance, in the last stanza of La Belle Heaulmière) more of
this important poetic virtue of seriousness than all the pro¬
ductions of Chaucer. But its apparition in Villon, and in
men like Villon, is fitful; the greatness of the great poets,
the power of their criticism of life, is that their virtue is
sustained.
[p. 35] The age of Dryden, together with our whole eighteenth
century which followed it, sincerely believed itself to have
produced poetical classics of its own, and even to have made
advance, in poetry, beyond all its predecessors. Dryden
regards as not seriously disputable the opinion 'that the
sweetness of English verse was never understood or practised
by our fathers.'1 Cowley could see nothing at all in Chaucer's
[1 [Note added by Dr. Furnivall on this passage]. We must recollect that, till
Tyrwhitt, no decent edition of the Canterbury Tales was accessible, and till Richard
Morris, none of the Minor Poems. So long as printers and editors disregarded
Chaucer's final e and printed as his, pieces that he never wrote, it was impossible
for any readers to appreciate his poetic powers.—F. J. F.]
poetry. Dryden heartily admired it, and, as we have seen,
praised its matter admirably; but of its exquisite manner and
movement all he can find to say is that 'there is the rude
sweetness of a Scotch tune in it, which is natural and pleasing,
though not perfect.' Addison, wishing to praise Chaucer's
numbers compares them with Dryden's own. And all through
the eighteenth century, and down even to our own times, the
stereotyped phrase of approbation for good verse found in our
early poetry has been, that it even approached the verse of
Dryden, Addison, Pope and Johnson.
[p. 49] Burns, like Chaucer, comes short of the high seriousness of
the great classics.
[p. 50] Yet we may say of Burns, as of Chaucer, that of life and
the world, as they come before him, his view is large, free,
shrewd, benignant,—truly poetic, therefore; and his manner
of rendering what he sees is to match. But we must note, at
the same time, his great difference from Chaucer. The freedom
of Chaucer is heightened, in Burns, by a fiery, reckless energy;
the benignity of Chaucer deepens, in Burns, into an over¬
whelming sense of the pathos of things;—of the pathos of
human nature, the pathos, also, of non-human nature. Instead
of the fluidity of Chaucer's manner, the manner of Burns has
spring, bounding swiftness. Burns is by far the greater force,
though he has perhaps less charm. The world of Chaucer is
fairer, richer, more significant than that of Burns."
supp_p78_a1,Supplement,,p78,1880.,N/A,"Cobham. The Reader's Handbook of Allusions,
references, plots and stories, London, 1880.
[Preface ","p. vii, and numerous references arranged alpha¬
betically.]
[The later editions (1898, 1911) are fuller, and the Canter¬
bury Tales are entered more systematically, thus we find
in these editions Parson's Tale, Miller's Tale, etc., omitted
here.]"
supp_p78_a2,Supplement,,p78,1880.,N/A,"Cobham. Dictionary of Phrase and Fable, 1st edn.,
London, 1880.
[Frequent references, as for instance, under Algarsife, Arcite,
Baillif, Herry [sic], Beard, Cambuscan, Canacë, etc.]",
supp_p78_a3,Supplement,,p78,1880.,"Cook, Albert ","S. Report on Englische Studien, ","vol. i [in] The
American Journal of Philology, vol. i, pp. 227, 228."
supp_p78_a4,Supplement,,p78,1880.,N/A,"J.] Notes on the Progress of the Chaucer Society's
Work ","[in] The Academy, London, Aug. 7, 1880, vol. xviii, p. 97,
col. 3, and Nov. 6, p. 328, col. 2.
[Recording the near completion of the textual work of the
Chaucer Society.]"
supp_p78_a5,Supplement,,p78,1880.,N/A,"J.] Note under Notes and News, ","[in] The Academy,
London, 26th June, vol. xvii, p. 472.
[Referring to a quarto volume of MS. acquired by Prof.
Dowden, lettered ""Chaucer's Canterbury Tales Modernised,
Vol. 2."" Neither the writer’s name nor that of any former
owner appears in the volume. The water-mark of the paper
is 1811. An extract given from the ""Prioresse Tale"" is
given. Query: Where is the first volume of this nineteenth
century Chaucer to be found ?]"
supp_p78_a6,Supplement,,p78,1880.,"Hamilton, Walter.","'The Origin of the Office of Poet Laureate'
","[in] Transactions of the Royal Historical Society, vol. viii, pp. 20,
30, 33, 35.
[p. 20] From the appointment of Chaucer about five hundred years
have elapsed, and during that period a long line of poets have
held the title of Laureate. ...
[p. 30] Geoffrey Chaucer, the first poet of any eminence who wrote
in the mother tongue, was styled Poet Laureate by his con¬
temporaries, and received several royal grants and offices. He
died on the 25th October, 1400, when his friend Sir John
Gower ... appears to have obtained or to have assumed the
title. . . .
p. 33] 1368. Edward III grants a daily pitcher of wine to Geoffrey
Chaucer, to be charged on the Port of London. Shortly after
his accession Richard II commuted that allowance for an
annual payment of twenty marks.
[p. 35] A Table of the Poets Laureate of England.
Date and
Date of
Sovereigns
Place of
Where
Death
Birth
Educated
Appoint¬
under whom
Place of
ment
they served
Burial
Geoffrey London, Cambridge
1368
Edward III
25th Oct.,
Westminster
Chaucer
1828
(?)
Richard II
1400
Abbey"
supp_p79_a1,Supplement,,p79,1880.,"Harris, George, ","LL.D. Domestic every-day Life, Manners, and
Customs ","in this Country, from the earliest Period to the end of the
Eighteenth Century. IV. From the end of the Thirteenth, to the
Commencement of the Sixteenth Century [in] Transactions of
the Royal Historical Society, vol viii, pp. 60-1.
[p. 60] Sir John Gower . . . is considered as the father of English
poetry. Geoffrey Chaucer is, however, the first of English
versifiers who wrote poetically."
supp_p79_a2,Supplement,,p79,1880.,N/A,"J. Chaucer's Pardoner and the Pope's Pardoner
[an essay], published by the Chaucer Soc. ","in Essays on Chaucer,
Part v, pp. 423-36."
supp_p79_a3,Supplement,,p79,1880.,"Lanier, Sidney.","The Science of English Verse, New York, 1880.
[Title-page [Chaucer quoted], v, vii, 87, 155-8 [Chaucer's
rhythms], 169-170 [Chaucer’s Final E], 172, 183, 184, 202,
217, 129-220 [Chaucer's use of initial accented syllable], 238,
240, 293.]",
supp_p79_a4,Supplement,,p79,1880.,"Lanier, Sidney.",Chaucer and Shakespeare [three papers ,"written
in, 1880, printed in] Music and Poetry, New York, 1909, pp.
159-196.
[The six works studied are A Midsummer Night's Dream
in conjunction with The Knight's Tale, Hamlet with the
Pardoner's Tale, and the Tempest with The Clerk's Tale.]"
supp_p7_a1,Supplement,,p7,1869.,"Russell, William Clark.",The ,"Book of Authors: a collection of
Criticisms, Ana, Mots, Personal Descriptions, etc. pp. 3-4.
[A Collection of Quotations from Caxton, Dryden, Byron,
Warton, Waller, Akenside, Wordsworth, the Quarterly Review,
Hallam, Hazlitt, John Fox, Johnson and W. Howitt on
Chaucer and his Work,—all printed in this volume under their
respective dates.]"
supp_p7_a2,Supplement,,p7,1869.,"Wright, Thomas.","Churchwarden’s Account of the Town of
Ludlow, Camden Soc., ","vol. cii, p. 97 n.
[Note upon an entry in the churchwarden's account ""for
mendynge and fasteninge the window over the wedinge
churche dore,"" calling attention to the frequent mention of
the wedding door in the accounts, and to the fact, that before
the Reformation important parts of the wedding and baptism
services, etc., were performed in the church porch.] The
reader of Chaucer will remember what he says (Cant. T.,
l. 462) of the Wife of Bath,—
""Housbandes atte chirche dore hadde sche fyfe."""
supp_p7_a3,Supplement,,p7,1870.,"Brae, Andrew Edmund.","The Treatise of the Astrolabe of Geoffrey
Chaucer, edited by A. E. Bray, London. 1870.
[The volume contains seven illustrations of Chaucers Astro¬
labe, with a text of his treatise, an Appendix reprinting
essays on the astronomy of the Canterbury Tales; and a
series of notes on Chaucer's astronomy ]",
supp_p7_a4,Supplement,,p7,1870.,"Brand, John, ","and Hazlitt, W. Carew. Popular Antiquities of
Great Britain. London. 1870. 3 vols.
[Vol. 1] ","pp. 31 [Chaucer quoted with reference to S. Valentine's
Day].
121-2 [The references to May-day Customs in the Court
of Love].
230 [Chaucer quoted with reference to St. Eloy's Day
Dec. 1st].
231 [Chaucer on St. Barbara].
303 [Chaucer on St. Julian].
[Vol. ii] pp. 5 [Speght’s ""Glossary to Chaucer""].
35 [Cock-crow, v, Assemble of Foules, 235].
81 [Chaucer's Miller of Trumpington wore a Sheffield
knife].
82 [Marriage Ceremony at the Church door, v. Chaucer's
Wife of Bath].
121, 133 [Chaucer's ""Prosopopeia of Jealousy""].
183 [""The Shooter Ewe""].
250 [Oaths and interjections. Chaucer's ""Hayt !""].
319 [Speght's Glossary—""Meritot"" in Chaucer].
[Vol. iii] pp. 32 [Chaucer's fairy mythology].
263. [Rural Charms:—""Nettle in, dock out,"" v. Troilus
and Cresseide].
342 [The Miller’s ""thombe of golde""]."
supp_p80_a1,Supplement,,p80,1880.,N/A,M. D. The Prologue ,"to the Canterbury Tales, with
notes, examination papers and glossary, London, 1880."
supp_p80_a2,Supplement,,p80,1880.,"Palgrave, Francis Turner.","The Visions of England. Fifty copies
","printed, 1880, pp. 36-39.
THE PILGRIM AND THE PLOUGHMAN:
[stanza 3] Beyond the bridge a mazy forest swims,
1382 . . .
Great sails and spars and flame-tongued flags on high,
Wedged ronnd the quays, a-throng with ruddy limbs
And faces bronzed beneath another sky:
And ’mid the press sits one with aspect shy
And downcast eyes of watching, and, the while,
The deep observance of an inward smile.
In hooded mantle gray he smiled and sate,
With ink-horn at his knees and scroll and pen,
And took the toll and register’d the freight,
'Mid noise of clattering cranes and strife of men:
And all that moved and spoke was in his ken,
In hues and lines like Nature’s own design’d
Within the magic mirror of his mind.
Thence oft, returning homeward, on the book,—
His of Certaldo, or the bard whose lays
Were lost to love in Scythia,—he would look
Till his fix’d eyes the dancing letters daze:
Then forth to the near fields, and feed his gaze
On one fair flower in starry myriads spread,
And in her graciousness be comforted:—
Then, joyous with a poet's joy, to draw
With genial touch, and strokes of patient skill,
The very image of each thing he saw :—
He limn’d the man all round, for good or ill,
Having both sighs and laughter at his will;
And picture-like his soul the world survey’d,
Yet stood outside the picture that he made.
—Man's inner passions in their conscience-strife,
The conflicts of the heart against the heart,
The mother yearning o’er the infant's life,
The maiden wrong’d by wealth and lecherous art,
The leper’s loathsome cell from man apart
War's savage lust and fire, the village woe,
The tinsel chivalry veiling shame below,—
Not his to draw,—to see, perhaps:—Our eyes
Hold bias with our humour:— His, to paint
With Nature's freshness, what before him lies:
The knave, the fool; the frolicsome, the quaint:
His the broad jest, the laugh without restraint,
The ready tears, the spirit lightly moved;
Loving his world, and by his world beloved.
So forth fared Chaucer on his pilgrimage
Through England’s humours; in immortal song
Bodying the form and pressure of his age,
Tints gay as pure, and delicate as strong;
Still to the Tabard the blithe travellers throng,
Seen in his mind so vividly, that we
Know them more nearly than the men we see.
Fair France, bright Italy those numbers train'd;
First in his pages Nature wedding Art
Of all our sons of song ; yet he remain’d
True English of the English at his heart:—
He stood between two worlds, yet had no part
In that new order of the dawning day
Which swept his realm of chivalry away.
. . . . . . . . . .
[stanza 14, Then on the mead in vision Langland saw
p. 38]
A pilgrim throng; not missal-bright as those
Whom Chaucer’s hand surpass'd itself to draw,
Gay as the lark, and brilliant as the rose;—
But such as dungeon foul or spital shows,
Or the serf's fever-den, or field of fight,
When festering sunbeams on the wounded smite."
supp_p82_a1,Supplement,,p82,1880.,"Rambeau, Adolf.","Chaucer's House of Fame and Dante's Divine
Comedy, [a series of articles ","in] The Home Journal (New York), May
and June, 1880, [translated and abridged from Rambeau’s Chaucer's
Hous of Fame in seinem Verhältniss zur Divina Commedia, in
Engl. Studien, 1880, iii, p. 209 ff. See W. O. Sypherd’s Studies
in Chaucer's House of Fame, Chaucer Society, 1907. Translator
unknown]."
