ID,Volume,Part,Page,Date,Author,Title,Quotation
supp_p49_a5,Supplement,,p49,1874.,N/A,J. (?). Wine receipts of Chaucer ,"[in] Notes and
News [in The Academy, Sept. 5, 1874, vol. vi, pp. 262-3."
supp_p49_a6,Supplement,,p49,1874.,"Green, John Richard.","A Short History of the English People
(Macmillan & Co.), ","pp. 163-4, 212, 213-6, 229, 231, 248, 249,
287, 288, 290.
[pp. 163-4] [Alfred’s English and Chaucer’s.]
[p. 212] [The Testament of Love. Its author’s love of English.]
[pp. 213-
[Outline of Chaucer’s biography, and note on his appear¬
16]
ance according to Hoccleve’s portrait and his own words.
His passage in the Hous of Fame on his evening study and
work.]
[p. 212] But of this abstraction from his fellows there is no trace
in his verse. No poetry was ever more human than Chaucer's;
none ever came more frankly and genially home to its readers.
... Nothing is more unreal than the tone of the French
romance, nothing more absolutely real than the tone of
Chaucer. If with the best modern critics we reject from the list
of his genuine works the bulk of the poems which preceded
""Troilus and Cressida,"" we see at once that, familiar as he
was with the literature of the Trouvères, his real sympathies
drew him not to the dying verse of France, but to the new
and mighty upgrowth of poetry in Italy. Dante’s eagle
looks at him from the sun. ""Fraunces Petrark, the laureat
poete"" is to him one ""whose rethorique sweete enlumyned
al Itaile of poetrie. The ""Troilus"" is an enlarged English
version of Boccaccio’s ""Filistrato,"" the Knight’s Tale of his
Teseide. It was, indeed, the ""Decameron"" which suggested
the very form of the ""Canterbury Tales."" But even while
changing, as it were, the front of English poetry, Chaucer
preserves his own distinct personality. If he quizzes in the
rime of Sir Thopaz, the wearisome idleness of the French
romance, he retains all that was worth retaining of the
French temper, its rapidity and agility of movement, its
[p. 215] lightness and brilliancy of touch, its airy mockery, its gaiety
and good humour, its critical coolness and self-control. The
French wit quickens in him more than in any English
writer the sturdy sense and shrewdness of our national dis¬
position, corrects its extravagance, and relieves its somewhat
ponderous morality. If, on the other hand, he echoes the
joyous carelessness of the Italian tale, he tempers it with
the English seriousness. As he follows Boccaccio, all his
changes are on the side of purity; and when the Troilus of
the Florentine ends with the old sneer at the changeableness,
of woman, Chaucer bids us ""look Godward,"" and dwells on
the unchangeableness of Heaven.
But the genius of Chaucer was neither French nor Italian,
whatever element it might borrow from either literature, but
English to the core.
[General discussion of the Tales and the pilgrims.]
[p. 216] . . . It is the first time in English poetry that we are
brought face to face not with characters or allegories or
reminiscences of the past, but with living and breathing
men, men distinct in temper and sentiment as in face or
costume or mode of speech; and with this distinctness of
each maintained throughout the story by a thousand shades
of expression and action. It is the first time, too, that we
meet with the dramatic power which not only creates each
character, but combines it with its fellows, which not only
adjusts each tale or jest to the temper of the person who
utters it, but fuses all into a poetic unity. ... He has
received his training from war, courts, business, travel—a
training not of books, but of life. And it is life that he
loves—the delicacy of its sentiment, the breadth of its force,
its laughter and its tears, the tenderness of its Grisildis or
the Smollett-like adventures of the miller and the schoolboy.
It is this largeness of heart, this wide tolerance, which enables
him to reflect man for us as none but Shakspeare has ever
reflected it, but to reflect it with a pathos, a shrewd sense
and kindly humour, a freshness and joyousness of feeling,
[pp. 229-
that even Shakspeare has not surpassed.
231]
[p. 248] Nothing brings more vividly home to us the social chasm
[Chaucer’s satire of the clerics.]
which in the fourteenth century severed the rich from the
poor than the contrast between the ""Complaint of Piers the
Ploughman"" and the ""Canterbury Tales."" The world of
wealth and ease and laughter through which the courtly
Chaucer moves with eyes downcast as in a pleasant dream
is a far-off world of wrong and of ungodliness to the gaunt
poet of the poor. ...
[For the passages on Chaucer, re-handled in the History
of the English People, see below, Green, 1877-80.]"
supp_p4_a1,Supplement,,p4,1869-75.,"Ellis, Alexander ","J. On Early English Pronunciation, with
especial reference ","to Shakspere and Chaucer, containing an investiga¬
tion of the correspondence of writing with speech in England from
the Anglo-Saxon period to the present day ... including a re-
arrangement of Prof. F. J. Child’s memoirs on the language of
Chaucer and Gower, Parts I and II, London, Chaucer Society and
E.E.T. soc., 1869; Part III, 1871; Part IV, 1875.
[The parts directly concerning Chaucer's language are:
Part I, chap. iv, 'On the pronunciation of English during
the 14th century, as deduced from an examination of the
rhymes in Chaucer and Gower,' pp. 241-416; Principles of
the Investigation, pp. 241-57; The Vowels, pp. 258-307;
The Consonants, pp. 308-17; On the pronunciation of
'e' final in the 14th century, pp. 318-42; F. J. Child’s Obser¬
vations on the language of Chaucer and Gower, pp. 342-
97; Chaucer’s pronunciation and orthography, pp. 397-
404. Part III, 1871, chap. vii, 'Illustrations of the Pro¬
nunciation of English during the 14th century,' pp. 633-
742. Chaucer, pp. 633-725; Critical text of Prologue,
pp. 639-4; Pronunciation of long U and of AY, EY, as
deduced from a comparison of the orthographies of seven
MSS. of the Canterbury Tales, pp. 634-56; Treatment of
final E in the critical text, pp. 646-8; Metrical peculiarities
of Chaucer, pp. 648-9; Chaucer's treatment of French
words, pp. 650-1; Pennsylvania German the analogue
of Chaucer's English, pp. 652-63; F. W. Gesenius on the
language of Chaucer, pp. 664-71; M. Rapp on the pronuncia¬
tion of Chaucer, pp. 672-7; Instructions for reading the
phonetic transcript of the Prologue, pp. 677-9; Critical
text of the Prologue to the C. Tales, from a collection of
seven MSS., in a systematic orthography, pp. 680-724
(even numbers); Conjectured pronunciation of the same,
pp. 681-725 (odd numbers)."
supp_p51_a1,Supplement,,p51,1874.,"Horwood, Alfred ",J. Report ,"[in] Fourth Report of the Royal
Commission on Historical Manuscripts, Appendix, pp. 252-3.
p. 253] Tumulus of Geoffrey Chaucer [see under c. 1680, Rogers].
To Chaucer's poems [see under c. 1680, Rogers]."
supp_p51_a2,Supplement,,p51,1874.,"Minto, William.","Characteristics of the English Poets from
Chaucer ","to Shirley, Edinburgh, 1874, pp. vii, 1-58 [Chapter I:
Geoffrey Chaucer], 61-6, 70-7, 81, 90, 91, 96, 99, 101-2, 105, 111,
122-6, 129, 130, 133-4, 143, 146, 149, 153, 170, 171, 213, 219,
220, 301.
[The Biography in the Chaucerian part is based on the
latest discoveries of Furnivall and other scholars, as well as
on the older material. Minto thinks the idea of Chaucer's
""hopeless passion"" in early life (based on the Complaint of
Pity.) etc. has been made too much of. A comparison be¬
tween Chaucer and Shakspere in their knowledge of men is
made, p. 17. Ten Brink's division of Chaucer's work into
three periods is rejected, as it seems to Minto that, from
first to last Chaucer had more affinity with the French than
with the Italians; and he adds: ""I can distinguish no
change either in his methods or in his spirit that is fairly
attributable to Italian influence,"" p. 19. The work of Ten
Brink, Bradshaw and Furnivall in proving the un-Chaucerian
character of the Testament of Love, Assembly of Ladies,
Lamentation of Mary Magdalene, Court of Love, Flower and
Leaf, and Chaucer’s Dream, is described. As the chief argu¬
ment is the y-ye rhyme, and as this is found in the Romaunt,
the whole question, according to Minto, depends largely on
this poem. Minto apparently clings to the belief of the
genuineness of the Court of Love. He remarks]:
[p. 21] It is simply incredible that these poems could have been
written by a poet whose name has perished. If he had
written before Chaucer, which could hardly be seriously
maintained, he could not but have become famous; and the
probability is that Chaucer would have mentioned him as
[p. 22] the model of his seven-line stanza. If he had written after
Chaucer, he would certainly have mentioned Chaucer in his
list of masters, according to the universal habit of the time.
The idea of deliberate forgery is out of the question; and if
the ""Court of Love"" had been the work of a forger or an
imitator, the artificial restriction of rhyme was precisely the
sort of thing he would labour to observe. Finally, the
""Court of Love"" is unmistakably imitated in the 'King’s
Quhair' of James I, whose captivity in England began
only five years after Chaucer’s death, and yet he mentions
no master except Chaucer, Gower and Lydgate. That
makes it quite clear that James attributed the ""Court of
Love"" to Chaucer; and what need is there for further
evidence?
[Subsequent sections of the Chaucer portion are, II.
His Language, Metres and Imagery. III. The Chief
Qualities of his Poetry. IV. His Delineation of Character.]
[p. 54] Observe, accordingly, how the tales are distributed. Nothing
ribald is put into the mouth of the gentles, and nothing ribald
is told concerning their order. ... [Elaboration of this.]"
supp_p53_a1,Supplement,,p53,1874.,"Ripley, George ","and Dana, Charles. The American Cyclopædia
A Popular Dictionary of General Knowgledge, ed. by George
Ripley, and Charles Dana. New York, 1874.
[Vol. iv,
","pp. 341-2] [Chaucer. A short ""Life"" and notice of his works.
[Vol. vi, John Dryden.
p. 277]
[Vol. viii, Godwin, William.]
p. 64]"
supp_p53_a2,Supplement,,p53,1874.,"Romilly, John ","[etc.]. Fourth Report of the Royal Commission
on Historical Manuscripts, London, 1874, ","p. xiii.
[On the Marquis of Hertford’s MS. of Latin poems by
Daniel Rogers. See under c. 1680, Rogers, above. The
Report is signed by all the fourteen commissioners,—Lord
Romilly, etc., besides the secretary, John Romilly.]"
supp_p53_a3,Supplement,,p53,1374.,"Ruskin, John.","Fors Clavigera, ","vol. iv, Letters 43, 45 (July
September, 1874). Works of Ruskin, ed. E. T. Cook and
A. Wedderburn, 1907, vol. xxviii, pp. 114, 160-3.
[p. 114] [Letter 43, July: a modernised version of the Chaucer
passage on Franchise in the Romaunt, Il. 1211-44.]
[pp. 160-3] [Letter 45, September: A similar version of the Largesse
passage, Il. 1138-49, 1176-85, with a note on Fournier's
French text and on Didot's edition, and on the date of the
text translated by Chaucer.]
"
supp_p54_a1,Supplement,,p54,1874.,N/A,"F. On Early English Pronunciation, with
especial reference ","to Chaucer, in opposition to the views main-
tained by A. J. Ellis in his work On Early English Pronunciation."
supp_p54_a2,Supplement,,p54,1875.,N/A,"J. Article [on] Chaucer, ","[in] Johnson's Universal Cyclo¬
pædia, 1875, vol. i, pp. 894-5.
[This article was enlarged by Child for the new edition of
Johnson's Universal Encyclopœdia, issued in 1894 under the
direction of C. K. Adams, see 1894.]"
supp_p54_a3,Supplement,,p54,1875.,"Clarke, Charles Cowden.","The Canterbury Tales of Chaucer
edited by Charles Cowden Clarke.",
supp_p54_a4,Supplement,,p54,1875.,"Furnivall, Frederick ","J. Review of Chaucer. The Prioresses
Tale, Sir Topas, etc., ed. by the Rev. W. W. Skeat, ","[in] The
Academy, March 27, 1875, vol. vii, pp. 316-7."
supp_p54_a5,Supplement,,p54,1875.,N/A,"J. ?] Notice of forthcoming publications by the
Chaucer Soc. ","[in] Notes and News, [in] The Academy, May 29, 1875,
vol. vii, p. 554."
supp_p54_a6,Supplement,,p54,1875.,"Furnivall, Frederick ","J. Animadversions ... by Francis Thynne,
ed. by G. H. Kingsley, Revis'd Edition by F. J. Furnivall, with a
Reprint of the only known Fragment of ""The Pilgrim’s Tale,""
E.E.T.S; Preface, ","pp. viii-x, xii-xvii; Hindwords, pp. xx, xxi,
xxiv-vi [Tuke’s dedication to Henry VIII, above, p. 79]; xlv n.,
xlvi, xlviii n., lxix, cii, ciii, cvi-vii, cxv-vii; f 75-6 [Bradshaw's
note, see under Bradshaw], above, 77-98 [Pilgrim’s Tale]; pp.
123-6 [Thomas Chaucer's Complaint on parting from his Wife,""
when he went into France]; Index, pp. 152-3, 163, 164, 165,
166, &c. [The references in the Preface are by Kingsley: see
above, under 1865.]
[p. cxvi] I hope it was from his [Thynne's] edition that Shakspere
read the Troylus and Cryseyde, and learnt to write The Rape
of Lucrece, which echoes Chaucer all through."
supp_p54_a7,Supplement,,p54,1875.,N/A,"20, 1875, ","vol. vii, p. 293."
supp_p54_a8,Supplement,,p54,1876.,"Longfellow, Henry Wadsworth.","The Masque of Pandora and
other Poems, ","pp. 95, 96, 140. Riverside edn. of Works, vol. v,
pp. 195, 196, 200, 217.
[Morituri Salutamus:]
[pp. 195, 196] Chaucer, at Woodstock with the nightingales,
At sixty wrote the Canterbury Tales.
. . . . . . . .
Even the oldest tree some fruit may bear;
Not Œdipus Coloneus, or Greek Ode,
Or tales of pilgrims that one morning rode
Out of the gateway of the Tabard Inn,
But other something, would we but begin;
For age is opportunity no less
Than youth itself, though in another dress. . . .
[A Book of Sonnets:]
CHAUCER.
[p. 200] An old man in a lodge within a park;
The chamber walls depicted all around
With portraitures of huntsmen, hawk, and hound,
And the hurt deer. He listeneth to the lark,
Whose song comes with the sunshine through the dark
Of painted glass in leaden lattice bound;
He listeneth and he laugheth at the sound,
Then writeth in a book like any clerk.
He is the poet of the dawn, who wrote
The Canterbury Tales, and his old age
Made beautiful with song; and as I read
I hear the crowing cock, I hear the note
Of lark and linnet, and from every page
Rise odors of ploughed field or flowery mead.
[Ib., Part II, p. 217:]
WOODSTOCK PARK.
Here in a little rustic hermitage
Alfred the Saxon King, Alfred the Great,
Postponed the cares of kingcraft to translate
The Consolations of the Roman sage.
Here Geoffrey Chaucer in his ripe old age
Wrote the unrivalled Tales, which soon or late
The venturous hand that strives to imitate
Vanquished must fall on the unfinished page.
Two kings were they, who ruled by right divine,
And both supreme; one in the realm of Truth,
One in the realm of Fiction and of Song."
supp_p56_a1,Supplement,,p56,1875.,"Pollard, Alfred William.","Chaucer. An Account of his Lief
and Work.
[Literature Primers, general editor, J. R. Green.].",
supp_p56_a2,Supplement,,p56,1875.,"Ruskin, John.",Letters ,"to Miss Susan Beever, Oct. 12th. Works
of Ruskin, Library edn. ed. E. T. Cook and A. Wedderburn, 1909,
[p. 181] I am very thankful for all your dear letters always—greatly
vol. xxxvii, p. 175, 181.
delighted above all with the squirrel one and Chaucer.
Didn’t he love squirrels!1
[1 Note by editors: quotation from the Book of the Duchess, p. 430.]
[p. 175-6] Yes, those are all sweetest bits from Chaucer (the pine
[Another letter to the same.]
new to me);2 your own copy is being bound. And all the
Richard,—but you must not copy out the Richard bits, for
I like all my Richard alike from beginning to end.
[2 Note by editors: see Romaunt of the Rose, 1455-64; ""the Richard"" may be the
""Ballade sent to King Richard,"" or the lines on the death of Richard in the ""Nonne
Preste's Tale,"" 527 seq.]
[p. 176] Yes, you will love and rejoice in your Chaucer more and
[Another letter to the same.]
more. Fancy, I’ve never time, now, to look at him,—
obliged to read even my Homer and Shakespeare at a scramble,
half missing the sense,—the business of life disturbs one so.
[p. 180] [Brief reference.]
[Another letter to the same, October 4th.]"
supp_p56_a3,Supplement,,p56,1875.,"Ruskin, John.",Mornings ,"in Florence, Part III. Before the
Soldan, §43, Works of Ruskin, Library edn., ed. E. T. Cook and
A. Wedderburn, 1906, vol. xxiii, p. 340.
And, finally, Giotto . . . has as much humour and
clearness of sight as Chaucer, and as much dislike of false¬
hood in clergy, or in professedly-pious people: and in his
gravest moments he will still see and say truly that what
is fat, is fat—and what is lean, lean—and what is hollow,
empty.
"
supp_p57_a1,Supplement,,p57,1875.,"Ruskin, John.","Fors Clavigera, ","vol. v, Letters 51, 53 (March, May,
1875), Works of Ruskin, ed. E. T. Cook and A. Wedderburn, 1907,
[p. 282-3] [Notes on ""like to the tremblinge after the clap of a
vol. xxviii, pp. 282-3, 322.
thunderinge"" (Hous of Fame, ii, 531), and ""And as a bytorne
[p. 322] [Brief reference.]
bumblith in the mire"" (Wyf of Bathes T., 116).]"
supp_p57_a2,Supplement,,p57,1875.,"Selby, Walford ","D. Life Records of Chaucer, Part I, The Rob¬
beries of Chaucer by Richard Brerelay and others at Westminster,
and at Hatcham, Surrey, on Tuesday, Sept. 6, 1390, with some
Account of the Robbers, from the Enrolments ","in the Public
Record Office, ed. by W. D. Selby."
supp_p57_a3,Supplement,,p57,1875.,"Swinburne, Algernon Charles.","Essays and Studies, ","pp. 86, 116
117, 122. London, 1875.
[p. 86] [Difficulty of first-rate tragic ballad-writing comparable with
Chaucer’s in compiling The Knight’s Tale.
[p. 116] Wm. Morris compared with Chaucer as a teller of tales.
[p. 117] Chaucer’s Knight.
[p. 122] Morris less careful than Chaucer in versification.]"
supp_p57_a4,Supplement,,p57,1875.,"Swinburne, Algernon Charles.","George Chapman. A Critical
Essay, ","pp. 164-5, 166. London, 1875.
[pp. 164-5] [Chaucer, Spenser and Chapman as narrative poets. Passage,
ending ""Chaucer, Wyatt and Spenser had left our language
as melodious, as fluent, as flexible for all purposes of narrative
or lyrical poetry, as it could be made by the grace of genius:
the supreme note of its possible music was reserved for
another to strike.""
[p. 166] Chapman perfected ""the exquisite metre invented for nar¬
rative by Chaucer.""]"
supp_p57_a5,Supplement,,p57,1876.,"Brooke, Stopford ","A. Primer of English Literature, 1st edition,
London, 1876, ","pp. 9, 21, 23, 27, 28, 32, 33-40 [account of Chaucer],
41, 42, 43, 46, 48-56 [influence of Chaucer], 57, 69, 70, 71, 72, 77,
124 [Addison's humour, like Chaucer's, is never bitter], 140 [18th
century study of Chaucer], 166, 167.
[There are many subsequent editions of this book. In 1890 it was re-issued 'with
additions,' and the 3rd edition, 1896 was 'partly re-written and largely revised and
corrected' when the Chaucer sections were enlarged, q.v. 1896, below, p.   ]"
supp_p57_a6,Supplement,,p57,1876.,"Fitzgerald, Edward.","Letters and Literary Remains of Edward
Fitzgerald, ed. W. A. Wright, 1889, ","vol. i, p. 300.
To C. E. Norton. Woodbridge, Feb. 7, 1876:—
Seeing what Mr. Lowell has done for Dante, Rousseau, &c.,
one does not wish him to be limited in his subjects: but I do
wish he would do for English writers what Ste. Beuve has
done for French.
kind: Chaucer, Pope (Dryden being done). . . .
... Of course one only wants the Great Men, in their"
supp_p58_a1,Supplement,,p58,1876-85.,N/A,"J. Autotype Specimens of the Chief Chaucer
","MSS. IV Parts, ed. for the Chaucer Society, London."
supp_p58_a2,Supplement,,p58,1876.,N/A,"J. Supplementary Canterbury Tales. The Tale
of Beryn, with a Prologue of the Merry Adventure of the Pardoner
with a Tapster at Canterbury, Part I, the Text (with maps), ed.
for the Chaucer Society.
The whole volume, edited by Furnivall and W. G. Stone, was issued for the E. E. T. S.
[Part II of this text by various authors appeared ","in 1887. See under that date
in 1909.]"
supp_p58_a3,Supplement,,p58,1876.,N/A,"J. A Course of Two Lectures on Chaucer,
delivered at the Royal Institution, Albemarle Street, W., ","in May,
1876."
supp_p58_a4,Supplement,,p58,1876.,"Haweis, Mary Eliza.","Chaucer for Children, A Golden Key,
illustrated with eight coloured Pictures, and numerous Woodcuts
by the Author, 1877.
[With a preface ""To the Mother"" on the reading and
pronunciation of Chaucer, followed by a biographical sketch
of Chaucer. Abridged stories from ""The Canterbury Tales""
and a few Minor Poems are then given.]",
supp_p58_a5,Supplement,,p58,1876.,N/A,"Article ""Chaucer"" ","in Encyclopædia Britannica.
Ninth Edition, 1876, vol. v, pp. 449-454.
"
supp_p59_a1,Supplement,,p59,1876.,"Romilly, John ","[&c.]. Fifth Report of the Royal Commission on
Historical Manuscripts, London, 1876, ","pp. x, xi.
[References to Mr. Bacon Frank’s Troilus MS. (the Camp¬
sall MS.) p. x.; Lord Leconfield’s Petworth MS. of the
Canterbury Tales, p. xi. Reports on these were issued
subsequently. See p.
The report is signed by all the Commissioners, besides the
Secretary, John Romilly.]"
supp_p59_a2,Supplement,,p59,1876.,"Ruskin, John.","Fors Clavigera, Letters 61, 65, January, May,
1876. Works of Ruskin, ed. E. T. Cook and A. Wedderburn,
","vol. xxviii, 1907, pp. 500-1, 595.
[pp. 500-1] 14. And for the standard theological writings which are
ultimately to be the foundation of this body of secular
literature, I have chosen seven authors, whose lives and works,
so far as the one can be traced or the other certified, shall
be ... prepared one by one in perfect editions for the
St. George’s schools. These seven books will contain, in
as many volumes as may be needful, the lives and writings
of the men who have taught the purest theological truth
hitherto known to the Jews, Greeks, Latins, Italians, and
English; namely Moses, David, Hesiod, Virgil, Dante,
Chaucer, and, for the seventh, summing the whole with
vision of judgment, St. John the Divine.
... Of Chaucer, I take the authentic poems, except the
Canterbury Tales; together with, be they authentic or not,
the Dream, and the fragment of the translation of the Romance
of the Rose, adding some French chivalrous literature of the
same date."
supp_p59_a3,Supplement,,p59,1876.,"Ruskin, John.",Preface ,"to The Economist of Xenophon, trans¬
lated by A. D. O. Wedderburn and W. G. Collingwood. Works of
Ruskin, Library edn, ed. E. T. Cook and A. Wedderburn, 1907,
vol. xxxi, pp. 21-2.
18. Rapidly comparing the five cities, whose story we
have to learn.
Then for each comes the day of Manifestation:
For Athens, The Ionian Migration, and Homer ...
For London, Her western sailors, and Chaucer."
supp_p59_a4,Supplement,,p59,1877.,"Digby, Kenelm Henry.","The Broad Stone of Honour: or The
True Sense and Practice of Chivalry [last and fullest edition].
","[vol. i] [Godefridus, pp. 3, 48, 96-98, 205, 269.
[vol. ii] Tancredus, pp. 91, 347, 349, 354.
[vol. iii] Morus, pp. 111 (reference to Wyatt’s lines, that he cannot
prefer Chaucer’s Sir Topas to his Palamon and Arcite), 112
183.
[vol. iv] Orlandus, pp. 10, 11, 32, 65, 183, 306, 344, 401.
[vol. v] Orlandus, pp. 1, 49, 72, 184, 243, 254, 373.]"
supp_p5_a1,Supplement,,p5,1869.,"Furnivall, Fredk.","James. Early English Text Society, Fifth
Report of the Committee, January, ","pp. 3, 4, 7, 8, 9, 10, 11, 16,
20, 21.
[p.10] No trustworthy text of Chaucer's Boethius has ever yet
appeared, nor has a text of any kind been procurable apart
from the poet’s other works. And yet the book has a double
interest. It is Chaucer's most important prose work, the
translation of a book whose echoes are heard through all his
other productions."
supp_p5_a2,Supplement,,p5,1869.,"Galton, Francis.","Hereditary Genius: an Inquiry into its Laws
and Consequences. London, 1869, ","pp. 226, 228, 230.
[Galton examines the relationships of 56 poets, 20 of these
among whom is Chaucer, have had, he says, eminent kinsfolk;
the following are his facts about Chaucer.]
[p. 230] Chaucer, Geoffrey; wrote the ""Court of Love"" æt. 18.
Illustrious poet; father of English poetry and, in some sense,
of the English language also.
S[on], Sir Thomas; was Speaker of the House of Commons
and ambassador to France."
supp_p5_a3,Supplement,,p5,1869.,N/A,W. Introduction ,"[to] Complete Works of Edmund
Spenser, by R. Morris and J. W. Hales. London, 1869. pp. xi-xiv,
xxvi, xliiï, xlvi.
[pp. xi, Chaucer and Spenser: Likenessess and differences,
xii, xiii, xiv, xxvi, Chaucer's influence, xliii, xlvi.]"
supp_p5_a4,Supplement,,p5,1869.,N/A,"Carew. English Proverbs and Proverbial Phrases,
","pp. x, 4, 11, 47, 114, 121, 128, 137, 176, 238, 265, 274, 275, 290,
371, 380, 473, 474, 476, 479.
"
supp_p60_a1,Supplement,,p60,1877.,N/A,G. Guide ,"to Chaucer and Spenser. London ...
1877.
[A small primer on Chaucer, packed with information,
sound and scholarly.]"
supp_p60_a2,Supplement,,p60,1877.,N/A,J. Criticism ,"in Academy, Dec. 8, pp. 525-6, of
F. G. Fleay's Guide to Chaucer and Spenser."
